{
  "$schema": "./schemas/document-guidance.schema.json",
  "schemaVersion": "1.0.0",
  "authority": "USCIS",
  "lastVerifiedAt": "2026-09-14T00:00:00Z",
  "guidance": [
    {
      "formId": "I-102",
      "formNumber": "I-102",
      "authority": "USCIS",
      "officialInstructionsUrl": "https://www.uscis.gov/sites/default/files/document/forms/i-102instr.pdf",
      "feeScheduleCitationUrl": "https://www.uscis.gov/g-1055",
      "feeUsdCents": null,
      "feeNotes": "Fee varies by filing channel, applicant category, or fee reduction status; consult official Form G-1055 fee schedule.",
      "evidenceChecklist": [
        "Government-issued photo identification",
        "Proof of lawful immigration status or inspection document (Form I-94)",
        "Petition-specific eligibility and supporting relational/financial documentation"
      ],
      "institutionGuidanceNotes": "Ensure edition date matches official USCIS edition requirements before filing."
    },
    {
      "formId": "I-129",
      "formNumber": "I-129",
      "authority": "USCIS",
      "officialInstructionsUrl": "https://www.uscis.gov/sites/default/files/document/forms/i-129instr.pdf",
      "feeScheduleCitationUrl": "https://www.uscis.gov/g-1055",
      "feeUsdCents": null,
      "feeNotes": "Fee varies by filing channel, applicant category, or fee reduction status; consult official Form G-1055 fee schedule.",
      "evidenceChecklist": [
        "Government-issued photo identification",
        "Proof of lawful immigration status or inspection document (Form I-94)",
        "Petition-specific eligibility and supporting relational/financial documentation"
      ],
      "institutionGuidanceNotes": "Ensure edition date matches official USCIS edition requirements before filing."
    },
    {
      "formId": "I-129CW",
      "formNumber": "I-129CW",
      "authority": "USCIS",
      "officialInstructionsUrl": "https://www.uscis.gov/sites/default/files/document/forms/i-129cwinstr.pdf",
      "feeScheduleCitationUrl": "https://www.uscis.gov/g-1055",
      "feeUsdCents": null,
      "feeNotes": "Fee varies by filing channel, applicant category, or fee reduction status; consult official Form G-1055 fee schedule.",
      "evidenceChecklist": [
        "Government-issued photo identification",
        "Proof of lawful immigration status or inspection document (Form I-94)",
        "Petition-specific eligibility and supporting relational/financial documentation"
      ],
      "institutionGuidanceNotes": "Ensure edition date matches official USCIS edition requirements before filing."
    },
    {
      "formId": "I-129CWR",
      "formNumber": "I-129CWR",
      "authority": "USCIS",
      "officialInstructionsUrl": "https://www.uscis.gov/sites/default/files/document/forms/i-129cwrinstr.pdf",
      "feeScheduleCitationUrl": "https://www.uscis.gov/g-1055",
      "feeUsdCents": null,
      "feeNotes": "Fee varies by filing channel, applicant category, or fee reduction status; consult official Form G-1055 fee schedule.",
      "evidenceChecklist": [
        "Government-issued photo identification",
        "Proof of lawful immigration status or inspection document (Form I-94)",
        "Petition-specific eligibility and supporting relational/financial documentation"
      ],
      "institutionGuidanceNotes": "Ensure edition date matches official USCIS edition requirements before filing."
    },
    {
      "formId": "I-129F",
      "formNumber": "I-129F",
      "authority": "USCIS",
      "officialInstructionsUrl": "https://www.uscis.gov/sites/default/files/document/forms/i-129finstr.pdf",
      "feeScheduleCitationUrl": "https://www.uscis.gov/g-1055",
      "feeUsdCents": null,
      "feeNotes": "Fee varies by filing channel, applicant category, or fee reduction status; consult official Form G-1055 fee schedule.",
      "evidenceChecklist": [
        "Government-issued photo identification",
        "Proof of lawful immigration status or inspection document (Form I-94)",
        "Petition-specific eligibility and supporting relational/financial documentation"
      ],
      "institutionGuidanceNotes": "Ensure edition date matches official USCIS edition requirements before filing."
    },
    {
      "formId": "I-129H1B",
      "formNumber": "H-1B Registration",
      "authority": "USCIS",
      "officialInstructionsUrl": "https://www.uscis.gov/sites/default/files/document/guides/H-1B-Electronic-Registration-Guide.pdf",
      "feeScheduleCitationUrl": "https://www.uscis.gov/g-1055",
      "feeUsdCents": null,
      "feeNotes": "Fee varies by filing channel, applicant category, or fee reduction status; consult official Form G-1055 fee schedule.",
      "evidenceChecklist": [
        "Government-issued photo identification",
        "Proof of lawful immigration status or inspection document (Form I-94)",
        "Petition-specific eligibility and supporting relational/financial documentation"
      ],
      "institutionGuidanceNotes": "Ensure edition date matches official USCIS edition requirements before filing."
    },
    {
      "formId": "I-129H2A",
      "formNumber": "H-2A Supplement",
      "authority": "USCIS",
      "officialInstructionsUrl": "https://www.uscis.gov/sites/default/files/document/forms/i-129instr.pdf",
      "feeScheduleCitationUrl": "https://www.uscis.gov/g-1055",
      "feeUsdCents": null,
      "feeNotes": "Fee varies by filing channel, applicant category, or fee reduction status; consult official Form G-1055 fee schedule.",
      "evidenceChecklist": [
        "Government-issued photo identification",
        "Proof of lawful immigration status or inspection document (Form I-94)",
        "Petition-specific eligibility and supporting relational/financial documentation"
      ],
      "institutionGuidanceNotes": "Ensure edition date matches official USCIS edition requirements before filing."
    },
    {
      "formId": "I-129S",
      "formNumber": "I-129S",
      "authority": "USCIS",
      "officialInstructionsUrl": "https://www.uscis.gov/sites/default/files/document/forms/i-129sinstr.pdf",
      "feeScheduleCitationUrl": "https://www.uscis.gov/g-1055",
      "feeUsdCents": null,
      "feeNotes": "Fee varies by filing channel, applicant category, or fee reduction status; consult official Form G-1055 fee schedule.",
      "evidenceChecklist": [
        "Government-issued photo identification",
        "Proof of lawful immigration status or inspection document (Form I-94)",
        "Petition-specific eligibility and supporting relational/financial documentation"
      ],
      "institutionGuidanceNotes": "Ensure edition date matches official USCIS edition requirements before filing."
    },
    {
      "formId": "I-130",
      "formNumber": "I-130",
      "authority": "USCIS",
      "officialInstructionsUrl": "https://www.uscis.gov/sites/default/files/document/forms/i-130instr.pdf",
      "feeScheduleCitationUrl": "https://www.uscis.gov/g-1055",
      "feeUsdCents": 67500,
      "feeNotes": "Official statutory fee of $675.00",
      "evidenceChecklist": [
        "Proof of petitioner's U.S. citizenship or lawful permanent resident status (e.g., birth certificate, passport, naturalization certificate, or green card)",
        "Civil marriage certificate or legal proof of family relationship",
        "Proof of legal termination of any prior marriages for both parties",
        "Two identical passport-style photographs of both petitioner and beneficiary"
      ],
      "institutionGuidanceNotes": "Ensure edition date matches official USCIS edition requirements before filing."
    },
    {
      "formId": "I-130A",
      "formNumber": "I-130A",
      "authority": "USCIS",
      "officialInstructionsUrl": "https://www.uscis.gov/sites/default/files/document/forms/i-130instr.pdf",
      "feeScheduleCitationUrl": "https://www.uscis.gov/g-1055",
      "feeUsdCents": null,
      "feeNotes": "Fee varies by filing channel, applicant category, or fee reduction status; consult official Form G-1055 fee schedule.",
      "evidenceChecklist": [
        "Employment history for the beneficiary for the previous five years",
        "Residential address history for the beneficiary for the previous five years"
      ],
      "institutionGuidanceNotes": "Ensure edition date matches official USCIS edition requirements before filing."
    },
    {
      "formId": "I-131",
      "formNumber": "I-131",
      "authority": "USCIS",
      "officialInstructionsUrl": "https://www.uscis.gov/sites/default/files/document/forms/i-131instr.pdf",
      "feeScheduleCitationUrl": "https://www.uscis.gov/g-1055",
      "feeUsdCents": null,
      "feeNotes": "Fee varies by filing channel, applicant category, or fee reduction status; consult official Form G-1055 fee schedule.",
      "evidenceChecklist": [
        "Government-issued photo identification",
        "Proof of lawful immigration status or inspection document (Form I-94)",
        "Petition-specific eligibility and supporting relational/financial documentation"
      ],
      "institutionGuidanceNotes": "Ensure edition date matches official USCIS edition requirements before filing."
    },
    {
      "formId": "I-131A",
      "formNumber": "I-131A",
      "authority": "USCIS",
      "officialInstructionsUrl": "https://www.uscis.gov/sites/default/files/document/forms/i-131ainstr.pdf",
      "feeScheduleCitationUrl": "https://www.uscis.gov/g-1055",
      "feeUsdCents": null,
      "feeNotes": "Fee varies by filing channel, applicant category, or fee reduction status; consult official Form G-1055 fee schedule.",
      "evidenceChecklist": [
        "Government-issued photo identification",
        "Proof of lawful immigration status or inspection document (Form I-94)",
        "Petition-specific eligibility and supporting relational/financial documentation"
      ],
      "institutionGuidanceNotes": "Ensure edition date matches official USCIS edition requirements before filing."
    },
    {